{
  "brand": {
    "id": "tenant-admin-brand",
    "label_key": null,
    "label": null,
    "subtitle_key": "surface.tenant_admin",
    "path": "/app/admin",
    "image": {
      "url": "/assets/brand/tchalanet-logo.svg",
      "alt_key": "brand.logo_alt",
      "title_key": null,
      "width": 36,
      "height": 36,
      "aspect_ratio": "1:1",
      "loading": "eager"
    }
  },
  "topDestinations": [
    {
      "id": "dashboard",
      "type": "destination",
      "label_key": "nav.dashboard",
      "label": null,
      "path": "/app/admin",
      "kind": "internal",
      "icon": "dashboard",
      "image": null,
      "active_match": "exact",
      "disabled": false,
      "reason_key": null,
      "badge": null,
      "children": []
    },
    {
      "id": "tenant_overview",
      "type": "destination",
      "label_key": "nav.tenant_overview",
      "label": null,
      "path": "/app/admin/overview",
      "kind": "internal",
      "icon": "map",
      "image": null,
      "active_match": "prefix",
      "disabled": false,
      "reason_key": null,
      "badge": null,
      "children": []
    }
  ],
  "sections": [
    {
      "id": "administration",
      "label_key": "nav.section.administration",
      "label": null,
      "items": [
        {
          "id": "users",
          "type": "destination",
          "label_key": "nav.users",
          "label": null,
          "path": "/app/admin/users",
          "kind": "internal",
          "icon": "group",
          "image": null,
          "active_match": "prefix",
          "disabled": false,
          "reason_key": null,
          "badge": null,
          "children": []
        },
        {
          "id": "outlets",
          "type": "destination",
          "label_key": "nav.outlets",
          "label": null,
          "path": "/app/admin/outlets",
          "kind": "internal",
          "icon": "storefront",
          "image": null,
          "active_match": "prefix",
          "disabled": false,
          "reason_key": null,
          "badge": null,
          "children": []
        },
        {
          "id": "terminals",
          "type": "destination",
          "label_key": "nav.terminals",
          "label": null,
          "path": "/app/admin/terminals",
          "kind": "internal",
          "icon": "point_of_sale",
          "image": null,
          "active_match": "prefix",
          "disabled": false,
          "reason_key": null,
          "badge": null,
          "children": []
        },
        {
          "id": "sessions",
          "type": "destination",
          "label_key": "nav.sessions",
          "label": null,
          "path": "/app/admin/sessions",
          "kind": "internal",
          "icon": "account_balance_wallet",
          "image": null,
          "active_match": "prefix",
          "disabled": false,
          "reason_key": null,
          "badge": null,
          "children": []
        }
      ]
    },
    {
      "id": "games_sales",
      "label_key": "nav.section.games_sales",
      "label": null,
      "items": [
        {
          "id": "tickets_sales",
          "type": "destination",
          "label_key": "nav.tickets_sales",
          "label": null,
          "path": "/app/admin/sales",
          "kind": "internal",
          "icon": "receipt_long",
          "image": null,
          "active_match": "prefix",
          "disabled": false,
          "reason_key": null,
          "badge": null,
          "children": []
        },
        {
          "id": "draws",
          "type": "destination",
          "label_key": "nav.draws",
          "label": null,
          "path": "/app/admin/draws",
          "kind": "internal",
          "icon": "event",
          "image": null,
          "active_match": "prefix",
          "disabled": false,
          "reason_key": null,
          "badge": null,
          "children": []
        },
        {
          "id": "games_pricing",
          "type": "destination",
          "label_key": "nav.games_pricing",
          "label": null,
          "path": "/app/admin/games-pricing",
          "kind": "internal",
          "icon": "casino",
          "image": null,
          "active_match": "prefix",
          "disabled": false,
          "reason_key": null,
          "badge": null,
          "children": []
        }
      ]
    },
    {
      "id": "business_rules",
      "label_key": "nav.section.business_rules",
      "label": null,
      "items": [
        {
          "id": "limits",
          "type": "destination",
          "label_key": "nav.limits",
          "label": null,
          "path": "/app/admin/limits",
          "kind": "internal",
          "icon": "rule",
          "image": null,
          "active_match": "prefix",
          "disabled": false,
          "reason_key": null,
          "badge": null,
          "children": []
        },
        {
          "id": "promotions",
          "type": "destination",
          "label_key": "nav.promotions",
          "label": null,
          "path": "/app/admin/promotions",
          "kind": "internal",
          "icon": "local_offer",
          "image": null,
          "active_match": "prefix",
          "disabled": false,
          "reason_key": null,
          "badge": null,
          "children": []
        }
      ]
    },
    {
      "id": "personalization",
      "label_key": "nav.section.personalization",
      "label": null,
      "items": [
        {
          "id": "settings",
          "type": "destination",
          "label_key": "nav.settings",
          "label": null,
          "path": "/app/admin/settings",
          "kind": "internal",
          "icon": "settings",
          "image": null,
          "active_match": "prefix",
          "disabled": false,
          "reason_key": null,
          "badge": null,
          "children": []
        },
        {
          "id": "translations",
          "type": "destination",
          "label_key": "nav.translations",
          "label": null,
          "path": "/app/admin/i18n",
          "kind": "internal",
          "icon": "translate",
          "image": null,
          "active_match": "prefix",
          "disabled": false,
          "reason_key": null,
          "badge": null,
          "children": []
        },
        {
          "id": "appearance",
          "type": "destination",
          "label_key": "nav.appearance",
          "label": null,
          "path": "/app/admin/appearance",
          "kind": "internal",
          "icon": "palette",
          "image": null,
          "active_match": "prefix",
          "disabled": false,
          "reason_key": null,
          "badge": null,
          "children": []
        }
      ]
    },
    {
      "id": "reports",
      "label_key": "nav.section.reports",
      "label": null,
      "items": [
        {
          "id": "reports",
          "type": "destination",
          "label_key": "nav.reports",
          "label": null,
          "path": "/app/admin/reports",
          "kind": "internal",
          "icon": "assessment",
          "image": null,
          "active_match": "prefix",
          "disabled": false,
          "reason_key": null,
          "badge": null,
          "children": []
        }
      ]
    }
  ],
  "footerDestinations": [],
  "actions": []
}